{
  "$schema": "https://json-schema.org/draft/2020-12/schema",
  "$id": "https://xlb.codemachine.in/schemas/analytics-snapshot.schema.json",
  "title": "XLB Analytics Snapshot",
  "type": "object",
  "additionalProperties": false,
  "required": [
    "capturedAt",
    "window",
    "sources",
    "pages"
  ],
  "properties": {
    "capturedAt": {
      "type": "string",
      "format": "date-time"
    },
    "window": {
      "type": "object",
      "additionalProperties": false,
      "required": [
        "start",
        "end"
      ],
      "properties": {
        "start": {
          "type": "string",
          "format": "date-time"
        },
        "end": {
          "type": "string",
          "format": "date-time"
        }
      }
    },
    "sources": {
      "type": "object",
      "additionalProperties": false,
      "properties": {
        "cloudflare": {
          "type": "boolean"
        },
        "searchConsole": {
          "type": "boolean"
        },
        "ga4": {
          "type": "boolean"
        },
        "adsense": {
          "type": "boolean"
        }
      }
    },
    "ga4": {
      "type": "object",
      "additionalProperties": false,
      "required": [
        "propertyId",
        "streamVerified",
        "stream",
        "rowCount",
        "totals",
        "dataStatus"
      ],
      "properties": {
        "propertyId": {
          "type": "string",
          "pattern": "^[0-9]+$"
        },
        "streamVerified": {
          "const": true
        },
        "stream": {
          "type": "object",
          "additionalProperties": false,
          "required": [
            "name",
            "type",
            "displayName",
            "measurementId",
            "defaultUri"
          ],
          "properties": {
            "name": { "type": "string", "minLength": 1 },
            "type": { "const": "WEB_DATA_STREAM" },
            "displayName": { "type": "string" },
            "measurementId": { "type": "string", "pattern": "^G-[A-Za-z0-9]+$" },
            "defaultUri": {
              "type": ["string", "null"],
              "format": "uri"
            }
          }
        },
        "rowCount": {
          "type": "integer",
          "minimum": 0
        },
        "totals": {
          "type": "object",
          "additionalProperties": false,
          "required": ["totalUsers", "sessions", "screenPageViews", "eventCount"],
          "properties": {
            "totalUsers": { "type": "number", "minimum": 0 },
            "sessions": { "type": "number", "minimum": 0 },
            "screenPageViews": { "type": "number", "minimum": 0 },
            "eventCount": { "type": "number", "minimum": 0 }
          }
        },
        "dataStatus": {
          "type": "string",
          "enum": ["data", "no-events-observed", "inconsistent"]
        }
      }
    },
    "pages": {
      "type": "array",
      "items": {
        "type": "object",
        "additionalProperties": false,
        "required": [
          "path",
          "pageviews",
          "engagementScore",
          "decision"
        ],
        "properties": {
          "path": {
            "type": "string",
            "minLength": 1
          },
          "pageviews": {
            "type": "number",
            "minimum": 0
          },
          "visits": {
            "type": "number",
            "minimum": 0
          },
          "searchImpressions": {
            "type": "number",
            "minimum": 0
          },
          "searchCtr": {
            "type": "number",
            "minimum": 0
          },
          "avgPosition": {
            "type": "number",
            "minimum": 0
          },
          "watchClicks": {
            "type": "number",
            "minimum": 0
          },
          "videoStarts": {
            "type": "number",
            "minimum": 0
          },
          "videoCompletes": {
            "type": "number",
            "minimum": 0
          },
          "videoScrollDepth": {
            "type": "number",
            "minimum": 0
          },
          "gameStarts": {
            "type": "number",
            "minimum": 0
          },
          "gameCompletes": {
            "type": "number",
            "minimum": 0
          },
          "galleryOpens": {
            "type": "number",
            "minimum": 0
          },
          "liveCardClicks": {
            "type": "number",
            "minimum": 0
          },
          "returnVisitors": {
            "type": "number",
            "minimum": 0
          },
          "revenueUsd": {
            "type": "number",
            "minimum": 0
          },
          "engagementScore": {
            "type": "number",
            "minimum": 0
          },
          "decision": {
            "type": "string",
            "enum": [
              "expand",
              "hold",
              "prune",
              "review"
            ]
          },
          "notes": {
            "type": "string"
          }
        }
      }
    }
  }
}
