{
  "capturedAt": "2026-05-21T06:00:00.000Z",
  "window": {
    "start": "2026-05-14T00:00:00.000Z",
    "end": "2026-05-21T00:00:00.000Z"
  },
  "sources": {
    "cloudflare": false,
    "searchConsole": true,
    "ga4": true,
    "adsense": false
  },
  "pages": [
    {
      "path": "/",
      "pageviews": 0,
      "visits": 0,
      "searchImpressions": 2,
      "searchCtr": 0,
      "avgPosition": 8,
      "watchClicks": 0,
      "videoStarts": 0,
      "videoCompletes": 0,
      "videoScrollDepth": 0,
      "gameStarts": 0,
      "gameCompletes": 0,
      "galleryOpens": 0,
      "liveCardClicks": 0,
      "returnVisitors": 0,
      "revenueUsd": 0,
      "engagementScore": 0,
      "decision": "review",
      "notes": "Imported from the Search Console API."
    },
    {
      "path": "/events/nasa-s-spacex-crs-35",
      "pageviews": 0,
      "visits": 0,
      "searchImpressions": 7,
      "searchCtr": 0,
      "avgPosition": 5,
      "watchClicks": 0,
      "videoStarts": 0,
      "videoCompletes": 0,
      "videoScrollDepth": 0,
      "gameStarts": 0,
      "gameCompletes": 0,
      "galleryOpens": 0,
      "liveCardClicks": 0,
      "returnVisitors": 0,
      "revenueUsd": 0,
      "engagementScore": 0,
      "decision": "review",
      "notes": "Imported from the Search Console API."
    },
    {
      "path": "/gallery",
      "pageviews": 0,
      "visits": 0,
      "searchImpressions": 3,
      "searchCtr": 0,
      "avgPosition": 6.333333333333333,
      "watchClicks": 0,
      "videoStarts": 0,
      "videoCompletes": 0,
      "videoScrollDepth": 0,
      "gameStarts": 0,
      "gameCompletes": 0,
      "galleryOpens": 0,
      "liveCardClicks": 0,
      "returnVisitors": 0,
      "revenueUsd": 0,
      "engagementScore": 0,
      "decision": "review",
      "notes": "Imported from the Search Console API."
    },
    {
      "path": "/news",
      "pageviews": 0,
      "visits": 0,
      "searchImpressions": 5,
      "searchCtr": 0,
      "avgPosition": 7.2,
      "watchClicks": 0,
      "videoStarts": 0,
      "videoCompletes": 0,
      "videoScrollDepth": 0,
      "gameStarts": 0,
      "gameCompletes": 0,
      "galleryOpens": 0,
      "liveCardClicks": 0,
      "returnVisitors": 0,
      "revenueUsd": 0,
      "engagementScore": 0,
      "decision": "review",
      "notes": "Imported from the Search Console API."
    }
  ]
}
