{
  "capturedAt": "2026-09-18T06:00:00.000Z",
  "window": {
    "start": "2026-08-20T00:00:00.000Z",
    "end": "2026-09-17T00:00:00.000Z"
  },
  "sources": {
    "cloudflare": false,
    "searchConsole": true,
    "ga4": false,
    "adsense": false
  },
  "pages": [
    {
      "path": "/",
      "pageviews": 0,
      "visits": 0,
      "searchImpressions": 6,
      "searchCtr": 0,
      "avgPosition": 12.833333333333334,
      "watchClicks": 0,
      "revenueUsd": 0,
      "engagementScore": 0,
      "decision": "review",
      "notes": "Imported from the Search Console API."
    },
    {
      "path": "/advertise",
      "pageviews": 0,
      "visits": 0,
      "searchImpressions": 4,
      "searchCtr": 0,
      "avgPosition": 7,
      "watchClicks": 0,
      "revenueUsd": 0,
      "engagementScore": 0,
      "decision": "review",
      "notes": "Imported from the Search Console API."
    },
    {
      "path": "/contact",
      "pageviews": 0,
      "visits": 0,
      "searchImpressions": 5,
      "searchCtr": 0,
      "avgPosition": 5.8,
      "watchClicks": 0,
      "revenueUsd": 0,
      "engagementScore": 0,
      "decision": "review",
      "notes": "Imported from the Search Console API."
    },
    {
      "path": "/events/nasa-s-spacex-crs-35",
      "pageviews": 0,
      "visits": 0,
      "searchImpressions": 15,
      "searchCtr": 0,
      "avgPosition": 8,
      "watchClicks": 0,
      "revenueUsd": 0,
      "engagementScore": 0,
      "decision": "review",
      "notes": "Imported from the Search Console API."
    },
    {
      "path": "/gallery",
      "pageviews": 0,
      "visits": 0,
      "searchImpressions": 70,
      "searchCtr": 0,
      "avgPosition": 3.942857142857143,
      "watchClicks": 0,
      "revenueUsd": 0,
      "engagementScore": 0,
      "decision": "review",
      "notes": "Imported from the Search Console API."
    },
    {
      "path": "/games",
      "pageviews": 0,
      "visits": 0,
      "searchImpressions": 2,
      "searchCtr": 0,
      "avgPosition": 7.5,
      "watchClicks": 0,
      "revenueUsd": 0,
      "engagementScore": 0,
      "decision": "review",
      "notes": "Imported from the Search Console API."
    },
    {
      "path": "/news",
      "pageviews": 0,
      "visits": 0,
      "searchImpressions": 4,
      "searchCtr": 0,
      "avgPosition": 4.5,
      "watchClicks": 0,
      "revenueUsd": 0,
      "engagementScore": 0,
      "decision": "review",
      "notes": "Imported from the Search Console API."
    },
    {
      "path": "/privacy",
      "pageviews": 0,
      "visits": 0,
      "searchImpressions": 2,
      "searchCtr": 0,
      "avgPosition": 5.5,
      "watchClicks": 0,
      "revenueUsd": 0,
      "engagementScore": 0,
      "decision": "review",
      "notes": "Imported from the Search Console API."
    },
    {
      "path": "/sports",
      "pageviews": 0,
      "visits": 0,
      "searchImpressions": 6,
      "searchCtr": 0,
      "avgPosition": 6,
      "watchClicks": 0,
      "revenueUsd": 0,
      "engagementScore": 0,
      "decision": "review",
      "notes": "Imported from the Search Console API."
    },
    {
      "path": "/tech",
      "pageviews": 0,
      "visits": 0,
      "searchImpressions": 5,
      "searchCtr": 0,
      "avgPosition": 6.8,
      "watchClicks": 0,
      "revenueUsd": 0,
      "engagementScore": 0,
      "decision": "review",
      "notes": "Imported from the Search Console API."
    },
    {
      "path": "/topics/nasa",
      "pageviews": 0,
      "visits": 0,
      "searchImpressions": 1,
      "searchCtr": 0,
      "avgPosition": 10,
      "watchClicks": 0,
      "revenueUsd": 0,
      "engagementScore": 0,
      "decision": "review",
      "notes": "Imported from the Search Console API."
    }
  ]
}
