{
  "capturedAt": "2026-05-05T06:00:00.000Z",
  "window": {
    "start": "2026-04-28T00:00:00.000Z",
    "end": "2026-05-05T00:00:00.000Z"
  },
  "sources": {
    "cloudflare": false,
    "searchConsole": true,
    "ga4": true,
    "adsense": false
  },
  "pages": [
    {
      "path": "/",
      "pageviews": 47,
      "visits": 8,
      "searchImpressions": 6,
      "searchCtr": 0,
      "avgPosition": 6.666666666666667,
      "watchClicks": 0,
      "videoStarts": 0,
      "videoCompletes": 0,
      "videoScrollDepth": 0,
      "gameStarts": 0,
      "gameCompletes": 0,
      "galleryOpens": 0,
      "liveCardClicks": 3,
      "returnVisitors": 21,
      "revenueUsd": 0,
      "engagementScore": 100,
      "decision": "review",
      "notes": "Imported from the GA4 Data API. | Imported from the Search Console API."
    },
    {
      "path": "/live",
      "pageviews": 35,
      "visits": 3,
      "searchImpressions": 0,
      "searchCtr": 0,
      "avgPosition": 0,
      "watchClicks": 0,
      "videoStarts": 0,
      "videoCompletes": 0,
      "videoScrollDepth": 0,
      "gameStarts": 0,
      "gameCompletes": 0,
      "galleryOpens": 0,
      "liveCardClicks": 0,
      "returnVisitors": 12,
      "revenueUsd": 0,
      "engagementScore": 100,
      "decision": "review",
      "notes": "Imported from the GA4 Data API."
    },
    {
      "path": "/video",
      "pageviews": 31,
      "visits": 7,
      "searchImpressions": 0,
      "searchCtr": 0,
      "avgPosition": 0,
      "watchClicks": 0,
      "videoStarts": 29,
      "videoCompletes": 15,
      "videoScrollDepth": 9,
      "gameStarts": 0,
      "gameCompletes": 0,
      "galleryOpens": 0,
      "liveCardClicks": 0,
      "returnVisitors": 7,
      "revenueUsd": 0,
      "engagementScore": 100,
      "decision": "review",
      "notes": "Imported from the GA4 Data API."
    },
    {
      "path": "/sports",
      "pageviews": 14,
      "visits": 5,
      "searchImpressions": 2,
      "searchCtr": 0,
      "avgPosition": 3,
      "watchClicks": 0,
      "videoStarts": 0,
      "videoCompletes": 0,
      "videoScrollDepth": 0,
      "gameStarts": 0,
      "gameCompletes": 0,
      "galleryOpens": 0,
      "liveCardClicks": 0,
      "returnVisitors": 0,
      "revenueUsd": 0,
      "engagementScore": 74,
      "decision": "review",
      "notes": "Imported from the GA4 Data API. | Imported from the Search Console API."
    },
    {
      "path": "/live/space",
      "pageviews": 12,
      "visits": 3,
      "searchImpressions": 0,
      "searchCtr": 0,
      "avgPosition": 0,
      "watchClicks": 0,
      "videoStarts": 0,
      "videoCompletes": 0,
      "videoScrollDepth": 0,
      "gameStarts": 0,
      "gameCompletes": 0,
      "galleryOpens": 0,
      "liveCardClicks": 0,
      "returnVisitors": 4,
      "revenueUsd": 0,
      "engagementScore": 76,
      "decision": "review",
      "notes": "Imported from the GA4 Data API."
    },
    {
      "path": "/news",
      "pageviews": 12,
      "visits": 5,
      "searchImpressions": 0,
      "searchCtr": 0,
      "avgPosition": 0,
      "watchClicks": 0,
      "videoStarts": 0,
      "videoCompletes": 0,
      "videoScrollDepth": 0,
      "gameStarts": 0,
      "gameCompletes": 0,
      "galleryOpens": 0,
      "liveCardClicks": 0,
      "returnVisitors": 0,
      "revenueUsd": 0,
      "engagementScore": 90,
      "decision": "review",
      "notes": "Imported from the GA4 Data API."
    },
    {
      "path": "/live/earth",
      "pageviews": 11,
      "visits": 3,
      "searchImpressions": 0,
      "searchCtr": 0,
      "avgPosition": 0,
      "watchClicks": 0,
      "videoStarts": 0,
      "videoCompletes": 0,
      "videoScrollDepth": 0,
      "gameStarts": 0,
      "gameCompletes": 0,
      "galleryOpens": 0,
      "liveCardClicks": 0,
      "returnVisitors": 3,
      "revenueUsd": 0,
      "engagementScore": 77,
      "decision": "review",
      "notes": "Imported from the GA4 Data API."
    },
    {
      "path": "/events/aurora-watch",
      "pageviews": 10,
      "visits": 2,
      "searchImpressions": 0,
      "searchCtr": 0,
      "avgPosition": 0,
      "watchClicks": 0,
      "videoStarts": 0,
      "videoCompletes": 0,
      "videoScrollDepth": 0,
      "gameStarts": 0,
      "gameCompletes": 0,
      "galleryOpens": 0,
      "liveCardClicks": 0,
      "returnVisitors": 0,
      "revenueUsd": 0,
      "engagementScore": 100,
      "decision": "review",
      "notes": "Imported from the GA4 Data API."
    },
    {
      "path": "/games",
      "pageviews": 10,
      "visits": 3,
      "searchImpressions": 1,
      "searchCtr": 0,
      "avgPosition": 4,
      "watchClicks": 0,
      "videoStarts": 0,
      "videoCompletes": 0,
      "videoScrollDepth": 0,
      "gameStarts": 6,
      "gameCompletes": 0,
      "galleryOpens": 0,
      "liveCardClicks": 0,
      "returnVisitors": 2,
      "revenueUsd": 0,
      "engagementScore": 81,
      "decision": "review",
      "notes": "Imported from the GA4 Data API. | Imported from the Search Console API."
    },
    {
      "path": "/tech",
      "pageviews": 8,
      "visits": 4,
      "searchImpressions": 0,
      "searchCtr": 0,
      "avgPosition": 0,
      "watchClicks": 0,
      "videoStarts": 0,
      "videoCompletes": 0,
      "videoScrollDepth": 0,
      "gameStarts": 0,
      "gameCompletes": 0,
      "galleryOpens": 0,
      "liveCardClicks": 0,
      "returnVisitors": 0,
      "revenueUsd": 0,
      "engagementScore": 75,
      "decision": "review",
      "notes": "Imported from the GA4 Data API."
    },
    {
      "path": "/gallery",
      "pageviews": 6,
      "visits": 3,
      "searchImpressions": 3,
      "searchCtr": 0,
      "avgPosition": 4,
      "watchClicks": 0,
      "videoStarts": 0,
      "videoCompletes": 0,
      "videoScrollDepth": 0,
      "gameStarts": 0,
      "gameCompletes": 0,
      "galleryOpens": 0,
      "liveCardClicks": 0,
      "returnVisitors": 0,
      "revenueUsd": 0,
      "engagementScore": 74,
      "decision": "review",
      "notes": "Imported from the GA4 Data API. | Imported from the Search Console API."
    },
    {
      "path": "/events/global-earthquake-watch",
      "pageviews": 4,
      "visits": 2,
      "searchImpressions": 0,
      "searchCtr": 0,
      "avgPosition": 0,
      "watchClicks": 0,
      "videoStarts": 0,
      "videoCompletes": 0,
      "videoScrollDepth": 0,
      "gameStarts": 0,
      "gameCompletes": 0,
      "galleryOpens": 0,
      "liveCardClicks": 0,
      "returnVisitors": 0,
      "revenueUsd": 0,
      "engagementScore": 100,
      "decision": "review",
      "notes": "Imported from the GA4 Data API."
    },
    {
      "path": "/events/nasa-live-programming",
      "pageviews": 2,
      "visits": 1,
      "searchImpressions": 0,
      "searchCtr": 0,
      "avgPosition": 0,
      "watchClicks": 0,
      "videoStarts": 0,
      "videoCompletes": 0,
      "videoScrollDepth": 0,
      "gameStarts": 0,
      "gameCompletes": 0,
      "galleryOpens": 0,
      "liveCardClicks": 0,
      "returnVisitors": 0,
      "revenueUsd": 0,
      "engagementScore": 71,
      "decision": "review",
      "notes": "Imported from the GA4 Data API."
    },
    {
      "path": "/topics/nasa",
      "pageviews": 0,
      "visits": 0,
      "searchImpressions": 2,
      "searchCtr": 0,
      "avgPosition": 5.5,
      "watchClicks": 0,
      "videoStarts": 0,
      "videoCompletes": 0,
      "videoScrollDepth": 0,
      "gameStarts": 0,
      "gameCompletes": 0,
      "galleryOpens": 0,
      "liveCardClicks": 0,
      "returnVisitors": 0,
      "revenueUsd": 0,
      "engagementScore": 0,
      "decision": "review",
      "notes": "Imported from the Search Console API."
    }
  ]
}
