{
  "capturedAt": "2026-04-28T06:00:00.000Z",
  "window": {
    "start": "2026-04-21T00:00:00.000Z",
    "end": "2026-04-28T00:00:00.000Z"
  },
  "sources": {
    "cloudflare": false,
    "searchConsole": true,
    "ga4": true,
    "adsense": false
  },
  "pages": [
    {
      "path": "/tech",
      "pageviews": 5,
      "visits": 2,
      "searchImpressions": 0,
      "searchCtr": 0,
      "avgPosition": 0,
      "watchClicks": 0,
      "revenueUsd": 0,
      "engagementScore": 71,
      "decision": "review",
      "notes": "Imported from the GA4 Data API."
    },
    {
      "path": "/news",
      "pageviews": 4,
      "visits": 2,
      "searchImpressions": 0,
      "searchCtr": 0,
      "avgPosition": 0,
      "watchClicks": 0,
      "revenueUsd": 0,
      "engagementScore": 72,
      "decision": "review",
      "notes": "Imported from the GA4 Data API."
    },
    {
      "path": "/video",
      "pageviews": 4,
      "visits": 2,
      "searchImpressions": 0,
      "searchCtr": 0,
      "avgPosition": 0,
      "watchClicks": 0,
      "revenueUsd": 0,
      "engagementScore": 74,
      "decision": "review",
      "notes": "Imported from the GA4 Data API."
    },
    {
      "path": "/",
      "pageviews": 2,
      "visits": 2,
      "searchImpressions": 5,
      "searchCtr": 0,
      "avgPosition": 6,
      "watchClicks": 0,
      "revenueUsd": 0,
      "engagementScore": 70,
      "decision": "review",
      "notes": "Imported from the GA4 Data API. | Imported from the Search Console API."
    },
    {
      "path": "/gallery",
      "pageviews": 2,
      "visits": 1,
      "searchImpressions": 3,
      "searchCtr": 0,
      "avgPosition": 4,
      "watchClicks": 0,
      "revenueUsd": 0,
      "engagementScore": 71,
      "decision": "review",
      "notes": "Imported from the GA4 Data API. | Imported from the Search Console API."
    },
    {
      "path": "/sports",
      "pageviews": 2,
      "visits": 1,
      "searchImpressions": 2,
      "searchCtr": 0,
      "avgPosition": 3,
      "watchClicks": 0,
      "revenueUsd": 0,
      "engagementScore": 70,
      "decision": "review",
      "notes": "Imported from the GA4 Data API. | Imported from the Search Console API."
    },
    {
      "path": "/games",
      "pageviews": 0,
      "visits": 0,
      "searchImpressions": 1,
      "searchCtr": 0,
      "avgPosition": 4,
      "watchClicks": 0,
      "revenueUsd": 0,
      "engagementScore": 0,
      "decision": "review",
      "notes": "Imported from the Search Console API."
    },
    {
      "path": "/topics/nasa",
      "pageviews": 0,
      "visits": 0,
      "searchImpressions": 2,
      "searchCtr": 0,
      "avgPosition": 5.5,
      "watchClicks": 0,
      "revenueUsd": 0,
      "engagementScore": 0,
      "decision": "review",
      "notes": "Imported from the Search Console API."
    }
  ]
}
