{
  "capturedAt": "2026-03-27T06:00:00.000Z",
  "window": {
    "start": "2026-03-26T00:00:00.000Z",
    "end": "2026-03-27T00:00:00.000Z"
  },
  "sources": {
    "cloudflare": false,
    "searchConsole": true,
    "ga4": false,
    "adsense": false
  },
  "pages": [
    {
      "path": "/live",
      "pageviews": 0,
      "visits": 0,
      "searchImpressions": 0,
      "searchCtr": 0,
      "avgPosition": 0,
      "watchClicks": 0,
      "revenueUsd": 0,
      "engagementScore": 0,
      "decision": "review",
      "notes": "Imported from Search Console-style export."
    },
    {
      "path": "/live/space",
      "pageviews": 0,
      "visits": 0,
      "searchImpressions": 0,
      "searchCtr": 0,
      "avgPosition": 0,
      "watchClicks": 0,
      "revenueUsd": 0,
      "engagementScore": 0,
      "decision": "review",
      "notes": "Imported from Search Console-style export."
    },
    {
      "path": "/events/nasa-live-programming",
      "pageviews": 0,
      "visits": 0,
      "searchImpressions": 0,
      "searchCtr": 0,
      "avgPosition": 0,
      "watchClicks": 0,
      "revenueUsd": 0,
      "engagementScore": 0,
      "decision": "review",
      "notes": "Imported from Search Console-style export."
    },
    {
      "path": "/events/upcoming-launch-window",
      "pageviews": 0,
      "visits": 0,
      "searchImpressions": 0,
      "searchCtr": 0,
      "avgPosition": 0,
      "watchClicks": 0,
      "revenueUsd": 0,
      "engagementScore": 0,
      "decision": "review",
      "notes": "Imported from Search Console-style export."
    },
    {
      "path": "/events/global-earthquake-watch",
      "pageviews": 0,
      "visits": 0,
      "searchImpressions": 0,
      "searchCtr": 0,
      "avgPosition": 0,
      "watchClicks": 0,
      "revenueUsd": 0,
      "engagementScore": 0,
      "decision": "review",
      "notes": "Imported from Search Console-style export."
    }
  ]
}
