{
  "capturedAt": "2026-06-05T06:00:00.000Z",
  "window": {
    "start": "2026-05-29T00:00:00.000Z",
    "end": "2026-06-05T00:00:00.000Z"
  },
  "sources": {
    "cloudflare": false,
    "searchConsole": false,
    "ga4": true,
    "adsense": false
  },
  "pages": [
    {
      "path": "/",
      "pageviews": 1,
      "visits": 1,
      "searchImpressions": 0,
      "searchCtr": 0,
      "avgPosition": 0,
      "watchClicks": 0,
      "videoStarts": 0,
      "videoCompletes": 0,
      "videoScrollDepth": 0,
      "gameStarts": 0,
      "gameCompletes": 0,
      "galleryOpens": 0,
      "liveCardClicks": 0,
      "returnVisitors": 1,
      "revenueUsd": 0,
      "engagementScore": 2,
      "decision": "review",
      "notes": "Imported from the GA4 Data API."
    }
  ]
}
