{
  "capturedAt": "2026-05-15T06:00:00.000Z",
  "window": {
    "start": "2026-05-08T00:00:00.000Z",
    "end": "2026-05-15T00:00:00.000Z"
  },
  "sources": {
    "cloudflare": false,
    "searchConsole": true,
    "ga4": true,
    "adsense": false
  },
  "pages": [
    {
      "path": "/live",
      "pageviews": 16,
      "visits": 2,
      "searchImpressions": 0,
      "searchCtr": 0,
      "avgPosition": 0,
      "watchClicks": 0,
      "videoStarts": 0,
      "videoCompletes": 0,
      "videoScrollDepth": 0,
      "gameStarts": 0,
      "gameCompletes": 0,
      "galleryOpens": 0,
      "liveCardClicks": 0,
      "returnVisitors": 9,
      "revenueUsd": 0,
      "engagementScore": 100,
      "decision": "review",
      "notes": "Imported from the GA4 Data API."
    },
    {
      "path": "/video",
      "pageviews": 14,
      "visits": 2,
      "searchImpressions": 0,
      "searchCtr": 0,
      "avgPosition": 0,
      "watchClicks": 0,
      "videoStarts": 19,
      "videoCompletes": 9,
      "videoScrollDepth": 0,
      "gameStarts": 0,
      "gameCompletes": 0,
      "galleryOpens": 0,
      "liveCardClicks": 0,
      "returnVisitors": 7,
      "revenueUsd": 0,
      "engagementScore": 100,
      "decision": "review",
      "notes": "Imported from the GA4 Data API."
    },
    {
      "path": "/news",
      "pageviews": 13,
      "visits": 2,
      "searchImpressions": 5,
      "searchCtr": 0,
      "avgPosition": 7.2,
      "watchClicks": 0,
      "videoStarts": 0,
      "videoCompletes": 0,
      "videoScrollDepth": 0,
      "gameStarts": 0,
      "gameCompletes": 0,
      "galleryOpens": 0,
      "liveCardClicks": 0,
      "returnVisitors": 8,
      "revenueUsd": 0,
      "engagementScore": 100,
      "decision": "review",
      "notes": "Imported from the GA4 Data API. | Imported from the Search Console API."
    },
    {
      "path": "/gallery",
      "pageviews": 11,
      "visits": 2,
      "searchImpressions": 1,
      "searchCtr": 0,
      "avgPosition": 5,
      "watchClicks": 0,
      "videoStarts": 0,
      "videoCompletes": 0,
      "videoScrollDepth": 0,
      "gameStarts": 0,
      "gameCompletes": 0,
      "galleryOpens": 1,
      "liveCardClicks": 0,
      "returnVisitors": 7,
      "revenueUsd": 0,
      "engagementScore": 65,
      "decision": "review",
      "notes": "Imported from the GA4 Data API. | Imported from the Search Console API."
    },
    {
      "path": "/sports",
      "pageviews": 11,
      "visits": 2,
      "searchImpressions": 1,
      "searchCtr": 0,
      "avgPosition": 3,
      "watchClicks": 0,
      "videoStarts": 0,
      "videoCompletes": 0,
      "videoScrollDepth": 0,
      "gameStarts": 0,
      "gameCompletes": 0,
      "galleryOpens": 0,
      "liveCardClicks": 0,
      "returnVisitors": 6,
      "revenueUsd": 0,
      "engagementScore": 83,
      "decision": "review",
      "notes": "Imported from the GA4 Data API. | Imported from the Search Console API."
    },
    {
      "path": "/live/earth",
      "pageviews": 10,
      "visits": 1,
      "searchImpressions": 0,
      "searchCtr": 0,
      "avgPosition": 0,
      "watchClicks": 0,
      "videoStarts": 0,
      "videoCompletes": 0,
      "videoScrollDepth": 0,
      "gameStarts": 0,
      "gameCompletes": 0,
      "galleryOpens": 0,
      "liveCardClicks": 0,
      "returnVisitors": 5,
      "revenueUsd": 0,
      "engagementScore": 80,
      "decision": "review",
      "notes": "Imported from the GA4 Data API."
    },
    {
      "path": "/live/space",
      "pageviews": 10,
      "visits": 1,
      "searchImpressions": 0,
      "searchCtr": 0,
      "avgPosition": 0,
      "watchClicks": 0,
      "videoStarts": 0,
      "videoCompletes": 0,
      "videoScrollDepth": 0,
      "gameStarts": 0,
      "gameCompletes": 0,
      "galleryOpens": 0,
      "liveCardClicks": 0,
      "returnVisitors": 5,
      "revenueUsd": 0,
      "engagementScore": 94,
      "decision": "review",
      "notes": "Imported from the GA4 Data API."
    },
    {
      "path": "/",
      "pageviews": 8,
      "visits": 2,
      "searchImpressions": 3,
      "searchCtr": 0,
      "avgPosition": 5.666666666666667,
      "watchClicks": 0,
      "videoStarts": 0,
      "videoCompletes": 0,
      "videoScrollDepth": 0,
      "gameStarts": 0,
      "gameCompletes": 0,
      "galleryOpens": 0,
      "liveCardClicks": 0,
      "returnVisitors": 5,
      "revenueUsd": 0,
      "engagementScore": 100,
      "decision": "review",
      "notes": "Imported from the GA4 Data API. | Imported from the Search Console API."
    },
    {
      "path": "/games",
      "pageviews": 8,
      "visits": 1,
      "searchImpressions": 1,
      "searchCtr": 0,
      "avgPosition": 4,
      "watchClicks": 0,
      "videoStarts": 0,
      "videoCompletes": 0,
      "videoScrollDepth": 0,
      "gameStarts": 5,
      "gameCompletes": 0,
      "galleryOpens": 0,
      "liveCardClicks": 0,
      "returnVisitors": 5,
      "revenueUsd": 0,
      "engagementScore": 100,
      "decision": "review",
      "notes": "Imported from the GA4 Data API. | Imported from the Search Console API."
    },
    {
      "path": "/tech",
      "pageviews": 8,
      "visits": 2,
      "searchImpressions": 0,
      "searchCtr": 0,
      "avgPosition": 0,
      "watchClicks": 0,
      "videoStarts": 0,
      "videoCompletes": 0,
      "videoScrollDepth": 0,
      "gameStarts": 0,
      "gameCompletes": 0,
      "galleryOpens": 0,
      "liveCardClicks": 0,
      "returnVisitors": 4,
      "revenueUsd": 0,
      "engagementScore": 80,
      "decision": "review",
      "notes": "Imported from the GA4 Data API."
    },
    {
      "path": "/events/nasa-s-spacex-crs-35",
      "pageviews": 0,
      "visits": 0,
      "searchImpressions": 5,
      "searchCtr": 0,
      "avgPosition": 5.4,
      "watchClicks": 0,
      "videoStarts": 0,
      "videoCompletes": 0,
      "videoScrollDepth": 0,
      "gameStarts": 0,
      "gameCompletes": 0,
      "galleryOpens": 0,
      "liveCardClicks": 0,
      "returnVisitors": 0,
      "revenueUsd": 0,
      "engagementScore": 0,
      "decision": "review",
      "notes": "Imported from the Search Console API."
    },
    {
      "path": "/topics/nasa",
      "pageviews": 0,
      "visits": 0,
      "searchImpressions": 1,
      "searchCtr": 0,
      "avgPosition": 6,
      "watchClicks": 0,
      "videoStarts": 0,
      "videoCompletes": 0,
      "videoScrollDepth": 0,
      "gameStarts": 0,
      "gameCompletes": 0,
      "galleryOpens": 0,
      "liveCardClicks": 0,
      "returnVisitors": 0,
      "revenueUsd": 0,
      "engagementScore": 0,
      "decision": "review",
      "notes": "Imported from the Search Console API."
    }
  ]
}
