{
  "capturedAt": "2026-06-23T06:00:00.000Z",
  "window": {
    "start": "2026-06-16T00:00:00.000Z",
    "end": "2026-06-23T00:00:00.000Z"
  },
  "sources": {
    "cloudflare": false,
    "searchConsole": true,
    "ga4": true,
    "adsense": false
  },
  "pages": [
    {
      "path": "/",
      "pageviews": 0,
      "visits": 0,
      "searchImpressions": 3,
      "searchCtr": 0,
      "avgPosition": 15.333333333333334,
      "watchClicks": 0,
      "videoStarts": 0,
      "videoCompletes": 0,
      "videoScrollDepth": 0,
      "gameStarts": 0,
      "gameCompletes": 0,
      "galleryOpens": 0,
      "liveCardClicks": 0,
      "returnVisitors": 0,
      "revenueUsd": 0,
      "engagementScore": 0,
      "decision": "review",
      "notes": "Imported from the Search Console API."
    },
    {
      "path": "/advertise",
      "pageviews": 0,
      "visits": 0,
      "searchImpressions": 1,
      "searchCtr": 0,
      "avgPosition": 8,
      "watchClicks": 0,
      "videoStarts": 0,
      "videoCompletes": 0,
      "videoScrollDepth": 0,
      "gameStarts": 0,
      "gameCompletes": 0,
      "galleryOpens": 0,
      "liveCardClicks": 0,
      "returnVisitors": 0,
      "revenueUsd": 0,
      "engagementScore": 0,
      "decision": "review",
      "notes": "Imported from the Search Console API."
    },
    {
      "path": "/gallery",
      "pageviews": 0,
      "visits": 0,
      "searchImpressions": 2,
      "searchCtr": 0,
      "avgPosition": 8,
      "watchClicks": 0,
      "videoStarts": 0,
      "videoCompletes": 0,
      "videoScrollDepth": 0,
      "gameStarts": 0,
      "gameCompletes": 0,
      "galleryOpens": 0,
      "liveCardClicks": 0,
      "returnVisitors": 0,
      "revenueUsd": 0,
      "engagementScore": 0,
      "decision": "review",
      "notes": "Imported from the Search Console API."
    },
    {
      "path": "/games",
      "pageviews": 0,
      "visits": 0,
      "searchImpressions": 4,
      "searchCtr": 0,
      "avgPosition": 7,
      "watchClicks": 0,
      "videoStarts": 0,
      "videoCompletes": 0,
      "videoScrollDepth": 0,
      "gameStarts": 0,
      "gameCompletes": 0,
      "galleryOpens": 0,
      "liveCardClicks": 0,
      "returnVisitors": 0,
      "revenueUsd": 0,
      "engagementScore": 0,
      "decision": "review",
      "notes": "Imported from the Search Console API."
    },
    {
      "path": "/news",
      "pageviews": 0,
      "visits": 0,
      "searchImpressions": 2,
      "searchCtr": 0,
      "avgPosition": 4.5,
      "watchClicks": 0,
      "videoStarts": 0,
      "videoCompletes": 0,
      "videoScrollDepth": 0,
      "gameStarts": 0,
      "gameCompletes": 0,
      "galleryOpens": 0,
      "liveCardClicks": 0,
      "returnVisitors": 0,
      "revenueUsd": 0,
      "engagementScore": 0,
      "decision": "review",
      "notes": "Imported from the Search Console API."
    },
    {
      "path": "/privacy",
      "pageviews": 0,
      "visits": 0,
      "searchImpressions": 1,
      "searchCtr": 0,
      "avgPosition": 9,
      "watchClicks": 0,
      "videoStarts": 0,
      "videoCompletes": 0,
      "videoScrollDepth": 0,
      "gameStarts": 0,
      "gameCompletes": 0,
      "galleryOpens": 0,
      "liveCardClicks": 0,
      "returnVisitors": 0,
      "revenueUsd": 0,
      "engagementScore": 0,
      "decision": "review",
      "notes": "Imported from the Search Console API."
    },
    {
      "path": "/sports",
      "pageviews": 0,
      "visits": 0,
      "searchImpressions": 2,
      "searchCtr": 0,
      "avgPosition": 4.5,
      "watchClicks": 0,
      "videoStarts": 0,
      "videoCompletes": 0,
      "videoScrollDepth": 0,
      "gameStarts": 0,
      "gameCompletes": 0,
      "galleryOpens": 0,
      "liveCardClicks": 0,
      "returnVisitors": 0,
      "revenueUsd": 0,
      "engagementScore": 0,
      "decision": "review",
      "notes": "Imported from the Search Console API."
    },
    {
      "path": "/tech",
      "pageviews": 0,
      "visits": 0,
      "searchImpressions": 3,
      "searchCtr": 0,
      "avgPosition": 8.666666666666668,
      "watchClicks": 0,
      "videoStarts": 0,
      "videoCompletes": 0,
      "videoScrollDepth": 0,
      "gameStarts": 0,
      "gameCompletes": 0,
      "galleryOpens": 0,
      "liveCardClicks": 0,
      "returnVisitors": 0,
      "revenueUsd": 0,
      "engagementScore": 0,
      "decision": "review",
      "notes": "Imported from the Search Console API."
    },
    {
      "path": "/topics/nasa",
      "pageviews": 0,
      "visits": 0,
      "searchImpressions": 1,
      "searchCtr": 0,
      "avgPosition": 10,
      "watchClicks": 0,
      "videoStarts": 0,
      "videoCompletes": 0,
      "videoScrollDepth": 0,
      "gameStarts": 0,
      "gameCompletes": 0,
      "galleryOpens": 0,
      "liveCardClicks": 0,
      "returnVisitors": 0,
      "revenueUsd": 0,
      "engagementScore": 0,
      "decision": "review",
      "notes": "Imported from the Search Console API."
    }
  ]
}
