{
  "capturedAt": "2026-04-15T06:00:00.000Z",
  "window": {
    "start": "2026-04-08T00:00:00.000Z",
    "end": "2026-04-15T00:00:00.000Z"
  },
  "sources": {
    "cloudflare": false,
    "searchConsole": true,
    "ga4": true,
    "adsense": false
  },
  "pages": [
    {
      "path": "/sports",
      "pageviews": 91,
      "visits": 15,
      "searchImpressions": 0,
      "searchCtr": 0,
      "avgPosition": 0,
      "watchClicks": 0,
      "revenueUsd": 0,
      "engagementScore": 95,
      "decision": "review",
      "notes": "Imported from the GA4 Data API."
    },
    {
      "path": "/news",
      "pageviews": 79,
      "visits": 13,
      "searchImpressions": 0,
      "searchCtr": 0,
      "avgPosition": 0,
      "watchClicks": 0,
      "revenueUsd": 0,
      "engagementScore": 100,
      "decision": "review",
      "notes": "Imported from the GA4 Data API."
    },
    {
      "path": "/live",
      "pageviews": 32,
      "visits": 11,
      "searchImpressions": 0,
      "searchCtr": 0,
      "avgPosition": 0,
      "watchClicks": 0,
      "revenueUsd": 0,
      "engagementScore": 70,
      "decision": "review",
      "notes": "Imported from the GA4 Data API."
    },
    {
      "path": "/games",
      "pageviews": 29,
      "visits": 8,
      "searchImpressions": 0,
      "searchCtr": 0,
      "avgPosition": 0,
      "watchClicks": 0,
      "revenueUsd": 0,
      "engagementScore": 85,
      "decision": "review",
      "notes": "Imported from the GA4 Data API."
    },
    {
      "path": "/tech",
      "pageviews": 28,
      "visits": 7,
      "searchImpressions": 0,
      "searchCtr": 0,
      "avgPosition": 0,
      "watchClicks": 0,
      "revenueUsd": 0,
      "engagementScore": 76,
      "decision": "review",
      "notes": "Imported from the GA4 Data API."
    },
    {
      "path": "/live/earth",
      "pageviews": 23,
      "visits": 7,
      "searchImpressions": 0,
      "searchCtr": 0,
      "avgPosition": 0,
      "watchClicks": 1,
      "revenueUsd": 0,
      "engagementScore": 100,
      "decision": "review",
      "notes": "Imported from the GA4 Data API."
    },
    {
      "path": "/live/space",
      "pageviews": 23,
      "visits": 9,
      "searchImpressions": 0,
      "searchCtr": 0,
      "avgPosition": 0,
      "watchClicks": 0,
      "revenueUsd": 0,
      "engagementScore": 93,
      "decision": "review",
      "notes": "Imported from the GA4 Data API."
    },
    {
      "path": "/gallery",
      "pageviews": 21,
      "visits": 6,
      "searchImpressions": 0,
      "searchCtr": 0,
      "avgPosition": 0,
      "watchClicks": 0,
      "revenueUsd": 0,
      "engagementScore": 100,
      "decision": "review",
      "notes": "Imported from the GA4 Data API."
    },
    {
      "path": "/",
      "pageviews": 20,
      "visits": 10,
      "searchImpressions": 2,
      "searchCtr": 0,
      "avgPosition": 11,
      "watchClicks": 0,
      "revenueUsd": 0,
      "engagementScore": 93,
      "decision": "review",
      "notes": "Imported from the GA4 Data API. | Imported from the Search Console API."
    },
    {
      "path": "/video",
      "pageviews": 20,
      "visits": 8,
      "searchImpressions": 0,
      "searchCtr": 0,
      "avgPosition": 0,
      "watchClicks": 0,
      "revenueUsd": 0,
      "engagementScore": 91,
      "decision": "review",
      "notes": "Imported from the GA4 Data API."
    },
    {
      "path": "/events/global-earthquake-watch",
      "pageviews": 2,
      "visits": 1,
      "searchImpressions": 0,
      "searchCtr": 0,
      "avgPosition": 0,
      "watchClicks": 0,
      "revenueUsd": 0,
      "engagementScore": 72,
      "decision": "review",
      "notes": "Imported from the GA4 Data API."
    },
    {
      "path": "/events/nasa-s-northrop-grumman-crs-24",
      "pageviews": 2,
      "visits": 1,
      "searchImpressions": 0,
      "searchCtr": 0,
      "avgPosition": 0,
      "watchClicks": 2,
      "revenueUsd": 0,
      "engagementScore": 84,
      "decision": "review",
      "notes": "Imported from the GA4 Data API."
    },
    {
      "path": "/events",
      "pageviews": 1,
      "visits": 1,
      "searchImpressions": 0,
      "searchCtr": 0,
      "avgPosition": 0,
      "watchClicks": 0,
      "revenueUsd": 0,
      "engagementScore": 72,
      "decision": "review",
      "notes": "Imported from the GA4 Data API."
    }
  ]
}
